,captions
377,"Image describes The image features a woman with a ponytail and a necklace, standing in front of a blue background. She is wearing a black shirt and appears to be the main focus of the image. The woman's presence and the blue background suggest that the image might be related to a business or professional context. The tweet's content, ""The Strategy Meeting <hyperlink> <hyperlink>"", implies that the image could be related to a meeting or a discussion involving strategies, plans, or decisions."
378,"Image describes A family poses for a photo in front of a map. They are sitting on a couch and smiling for the camera. The family consists of both adults and children, and they appear to be enjoying their time together. The image captures a moment of togetherness and happiness, which is a stark contrast to the challenging times that families are facing due to the COVID-19 pandemic and its impact on border rules. The tweet highlights the difficulties faced by families in these circumstances and calls for change in the border rules to ease the burden on these families."
379,"Image describes A person with a bald head is lying down next to a skeleton. The image is dark and has a creepy vibe. The person is wearing a black shirt. The skeleton is also lying down, and it appears to be made of metal. The image is part of a tweet announcing the release of a new album called ""GRYPT 'the cost of living'"". The tweet encourages people to retweet to defeat the algorithms."
380,Image describes The Nigerian Medical Association (NMA) is calling for stringent border control in Plateau following the confirmation of an index case of COVID-19. The NMA is concerned about the potential spread of the virus and is urging authorities to take immediate action to prevent further infections. The association is also emphasizing the importance of adhering to public health guidelines and protocols to curb the spread of the virus.
381,Image describes A man wearing a blue shirt and holding his face in his hands.
382,"Image describes The image shows four men dressed in suits standing in front of a model airplane. One of the men, who is wearing a tie, is holding the model airplane. The men appear to be businessmen, possibly executives of Qatar Airways, as they pose for a picture. The presence of the model airplane suggests that they might be discussing or promoting their airline's expansion plans and new destinations. The tweet by Qatar Airways' GCEO, Mr. Akbar Al Baker, highlights the airline's aggressive expansion plans and 16 new destinations launching in 2018/2019."
383,There is nothing here
384,There is nothing here
385,Image describes A person using a laptop with a cup of coffee nearby.
386,"Image describes A man stands in front of a pile of trash, holding a sign that says ""What's down away looks like"". The pile consists of various items, including a sports ball, a suitcase, and a bottle. The man's sign is a commentary on the issue of plastic waste and its impact on the environment."
387,Image describes A brick wall with a shop sign in front of it.
388,Image describes The image shows President Trump looking into the camera with a stern expression. The tweet suggests that the Special Counsel Robert Mueller has considered the President's written responses as inadequate. This implies that the investigation might be facing challenges in obtaining the necessary information from the President. The image captures the tense atmosphere surrounding the ongoing investigation.
389,"Image describes Three women are standing together, smiling and posing for a picture. They are all dressed in matching outfits, which include pink shirts and black shorts. They are outside, possibly at a golf course, as they are participating in a charity event. The women are enjoying their time together and are happy to be a part of the event."
390,"GIF describes A man in a suit is sitting in the audience, clapping his hands. He appears to be a professional or a VIP, possibly at a formal event or a theater performance. The tweet suggests that the man is a stud and that the event is a success. The tweet also contains a hashtag and a hyperlink, which might be related to the event or the man's brand."
391,"Image describes The image attached to the tweet shows a train moving along the tracks, with a heart-shaped window on the front. The caption reads, ""The first subway system opened in 1904, instigating the train, ""Mayor George B. McClellan,"" and driving for most of the job."" The image and caption together convey the idea that the development of the subway system has had a significant impact on transportation and urban life."
392,Image describes A young boy wearing a yellow shirt is leaning against a wooden wall. The image is used to promote ARM Life's educational planning services. The tweet encourages people to get in touch with ARM Life to discuss options for their child's educational future. The hashtag #LivingBenefits and #Education are included in the tweet.
393,There is nothing here
394,"GIF describes A woman in a pink shirt is sitting at a table with a man in a white shirt. The woman is making a funny face and appears to be surprised or reacting to something. The scene seems to be a casual, lighthearted moment shared between the two individuals."
395,"Image describes BTS, a popular Korean boy band, made history by becoming the first-ever Korean act to perform at the Billboard Music Awards. They performed their new single ""Fake Love"" and won the award for Top Social Artist. The image shows the band members on stage, with one of them holding a microphone. This moment marked a significant milestone for BTS and showcased their talent and global impact."
396,Image describes A man wearing a green leaf hat and sunglasses is smoking a cigarette. The image is likely related to the tweet about Canada legalizing weed nationwide. The man's attire and the act of smoking suggest a connection to the topic of marijuana legalization.
397,Image describes The image shows a map of Abia State in Nigeria with a yellow outline. The caption suggests that the UDA organization has donated an office complex worth over N15m to the police. The donation is likely aimed at supporting the police force in their efforts to maintain law and order in the state.
398,There is nothing here
399,There is nothing here
400,"Image describes Manchester City dominated the match against Watford, winning 4-0. The team's performance was strong, with players displaying excellent teamwork and skill. The victory highlights Manchester City's superiority in the league and their ability to outplay their opponents."
401,There is nothing here
402,GIF describes The image accompanying the tweet is a blue and green background with a white and black striped pattern. The image is blurry and not easily discernible.
403,"Image describes A man in a grey suit and tie, possibly James McAvoy, is pointing at something on a field. He is standing on the sideline of the field, and there are several other people around him. The man appears to be engaged in a conversation or making a point, possibly related to the soccer game taking place."
404,"Image describes Jennifer Lopez is coming to Houston for a show on June 25th, and you can be a part of the party. Get your tickets now and join the fun."
405,"Image describes A nighttime view of a highway with a city skyline in the background. The image showcases the city's infrastructure and the bright lights of the buildings. The tweet is likely referring to a case study or success story about a data center upgrade in Bulgaria, highlighting the modernization and simplification of the existing infrastructure."
406,"GIF describes The image shows a laptop screen with a blue background and a number one written on it. The laptop is open, and the screen is ready for a presentation. The tweet suggests using a Surface pen to control the presentation and provides a link to learn more about this feature."
407,"Image describes A group of jockeys riding horses in a race. The horses are running on a grassy track, with jockeys wearing helmets and riding gear. The image captures the excitement and energy of the race, as the horses and their riders compete against each other. The event is taking place at the H.H. The Amir Sword Festival 2019 in Doha, Qatar."
408,"Image describes The image attached to the tweet features a red alarm bell with a caption that reads ""Be Alert"". The image is meant to remind people to stay cautious and alert while banking to protect themselves from potential fraudulent attacks. The tweet also includes a link to the #SafeBanking tips, which provide additional information on how to safeguard oneself from potential scams."
409,There is nothing here
410,There is nothing here
411,"Image describes A man in a suit and tie is smiling and laughing while holding a jacket. He appears to be a reporter, and he is talking about the Trump administration. The image is likely related to the tweet, which discusses the reporter's analysis of the Trump administration."
412,Image describes A smiling man in a blue shirt and glasses is working on his laptop. He is wearing headphones and appears to be focused on his work. This image could represent the importance of providing remote workers with the necessary tools and resources to stay productive and secure in their work environment. The tweet suggests that organizations should consider these strategies to ensure the safety and success of their remote workforce.
413,There is nothing here
414,"Image describes A bowl of Blue Bell Southern Blackberry Ice Cream Cobbler is displayed on a table. The ice cream is served in a glass bowl, accompanied by a spoon. The cobbler is a creamy dessert with a blackberry flavor and flaky pie crust pieces. The image showcases the deliciousness of the ice cream cobbler, making it an appealing treat for those who enjoy a sweet, fruity dessert."
415,"Image describes The image shows two people fighting in a dark setting, with one person holding a gun. The caption reads ""The weekend is here. Me: I'm going to go out and get some zombie blood on my hands."" The tweet is promoting the show ""Fear the Walking Dead"" and encouraging viewers to watch the double episode tonight at 9 pm."
416,There is nothing here
417,"Image describes A woman with a nose ring, wearing a black choker, and a flowered headband is looking at the camera. She is the trickster star encouraging Inuit youth to follow their passion."
418,There is nothing here
419,There is nothing here
420,There is nothing here
421,"Image describes A man is painting a mural on a wall, standing on a scissor lift. He is wearing an orange vest and is smiling for the camera. The mural is being painted on the west side of Avon Avenue bridge."
422,"Image describes A pair of white shoes is sitting on a yellow rug with a lemon design. The rug is placed in front of a door. The shoes are positioned in such a way that they appear to be standing on the rug. The scene gives off a playful and creative vibe, making it a fitting image to accompany a tweet about a lemonade craving."
423,"Image describes A man in a cowboy hat stands next to a Walmart truck, representing the company in trucking rodeos."
424,"Image describes A lion with a mane stares directly into the camera, appearing to be the main focus of the image. The lion's eyes are wide open, capturing attention. The event being advertised is a ""Celebration of Wildlife,"" and volunteers are needed to help out."
425,"Image describes Three Barbie dolls are displayed in a row, each representing a different historical figure. The first doll is dressed as Amelia Earhart, the second as Frida Kahlo, and the third as Katherine Johnson. These dolls are being showcased in honor of International Women's Day."
426,"Image describes Doug Ford, Ontario's Premier-designate, has announced his intention to end the cap-and-trade carbon tax. The news release confirms this priority. The background provided includes links to related articles discussing the topic."
427,There is nothing here
428,"Image describes The image shows three men wearing black masks and holding guns, standing close to each other. They appear to be kidnappers, as they are described as ""gunmen"" in the tweet. The tweet also mentions the daughter of Atiku's cousin being kidnapped, which adds context to the situation depicted in the image."
429,"Image describes The image features a close-up of a Call of Duty A10 headset, showcasing its intricate details. The headset has a sleek design with red accents and a black background. The headset is equipped with a microphone and a volume control, making it a versatile gaming accessory. The headset's design and attention to detail make it a popular choice for gamers seeking a high-quality audio experience."
430,"Image describes A man wearing a purple hat and glasses is speaking into a microphone. He appears to be an older gentleman with a beard and mustache. The man is wearing a white shirt and a purple hat. The microphone is positioned close to his mouth, allowing his voice to be clearly heard. The man seems to be giving a speech or addressing an audience."
431,"Image describes A woman is sitting at a desk with a laptop, keyboard, and papers in front of her. She is smiling and appears to be preparing for a video conference interview. The laptop is open and ready for the interview, and the woman is dressed appropriately for the occasion. The image conveys a sense of confidence and readiness for the upcoming video conference."
432,"Image describes The image features three colorful gazing balls placed on the grass. The gazing balls are of different sizes and colors, adding a vibrant touch to the garden. The tweet suggests that these gazing balls are currently on sale, making them an attractive option for anyone looking to brighten up their garden space."
433,"Image describes A man in a suit and tie is smiling for the camera. He is wearing a white shirt and a brown jacket. The man is the co-founder and president of a company, and the tweet is celebrating his birthday. The image is accompanied by the hashtag #KeepWildlifeInTheWild, which emphasizes the importance of protecting wildlife and their natural habitats."
434,There is nothing here
435,There is nothing here
436,There is nothing here
437,There is nothing here
438,"Image describes A group of soccer players are on a field, with one man in the center smiling and laughing. The other players are also engaged in the game, with some of them wearing red uniforms. The scene captures the camaraderie and enjoyment of the sport among the players."
439,"Image describes A man in a black suit and tie is holding a microphone and smiling. He is wearing a black tie and is standing in front of a backdrop with sparkling lights. The backdrop says ""Robbie Williams Las Vegas"". The man appears to be excited about his first ever Vegas residency."
440,"Image describes The image features Bernie Sanders and Cardi B, with Bernie on the left and Cardi B on the right. They are both wearing formal attire, with Bernie wearing a suit and tie and Cardi B wearing a dress. The image is likely related to the tweet about their collaboration on a video targeting young voters."
441,"Image describes A woman in a pink shirt and glasses is making a funny face while holding her fingers under her nose. She is wearing a denim jumpsuit and appears to be playfully expressing her feelings about contraceptive and family planning options. The image is likely meant to be humorous and lighthearted, while also drawing attention to the importance of global health goals."
442,There is nothing here
443,"Image describes A laptop screen shows a map and a list of locations, indicating that Cisco DNA Center can help solve network struggles. The tweet suggests that the manual process of solving network issues can be automated and simplified with the use of Cisco DNA Center. The attached media demonstrates how the software can be used to manage and optimize network performance."
444,"Image describes The image shows a group of people gathered around two men riding green bicycles. The men are wearing suits and ties, and there is a flag nearby. The scene appears to be a formal event or a launch of a new service, possibly related to the DMRC and Mobycy Zypp e-cycle service. The presence of the flag and the formal attire of the men on the bicycles suggest that this is an important occasion."
445,"Image describes The image features the Bayelsa State Government logo, which includes a tiger, a shark, a giraffe, and a crocodile. The logo is displayed on a blue background. The image is likely related to the World Environment Day Global Online Summit being hosted by Bayelsa State."
446,"Image describes Pete Buttigieg, a gay Christian, is driving the religious right nuts. CNN's analysis of the impact of his candidacy on the religious right."
447,There is nothing here
448,"Image describes The image is a list of snacks and beverages, each corresponding to a zodiac sign. The snacks include a hot dog, a donut, a pickle, a beef stick, and an apple. The beverages include a cup of coffee, a glass of juice, a cup of ice cream, and a cup of beer. The list is organized in a way that makes it easy for people to find their corresponding snack or drink based on their zodiac sign. This image is a fun and creative way to engage with astrology and horoscopes."
449,There is nothing here
450,Image describes A red and white IndyCar race car is shown driving on a track. The car is sponsored by Hushi Chocolate. The driver of the car is wearing a red and white uniform. The car is racing around a curve on the track.
451,"Image describes The image shows two women smiling and posing for a picture. They are both wearing headphones, indicating that they are likely participating in a live event or a video call. The background features a blue wall, and there is a clock on the wall, suggesting that the event is time-sensitive. The women appear to be engaged in a conversation or presentation, and their smiles suggest that they are enjoying the experience."
452,There is nothing here
453,"Image describes The image shows two men in suits, one wearing a tie, standing in front of a building. They appear to be politicians, possibly discussing the recent deal between the Liberals and the NDP on sick leave. The man on the left is wearing a suit and tie, while the man on the right is wearing a suit without a tie. They are both looking at the camera, possibly addressing the media or the public. The scene suggests that the two politicians are involved in a political discussion or negotiation, which is relevant to the tweet's content."
454,"GIF describes A globe on a stand with a pinpointed location and the words ""MeetMeet Collaboration"" written on it."
455,"Image describes A group of jockeys riding horses on a track, with one horse in the lead. The image captures the excitement and action of a horse race, which is a popular event at the Killarney August Racing Festival. The festival continues until Saturday, and this image showcases the thrilling experience that attendees can expect to see during the event."
456,"Image describes A smiling man in a black hat and leather jacket is the focus of the image. He is promoting an acoustic set, Q&A, and Meet & Greet event for fans of the American Family Insurance Summer Series. The event will take place on June 30 at 2:00 pm at the American Family Insurance House. The man's cheerful expression and the event's casual atmosphere suggest a fun and engaging experience for attendees."
457,"Image describes A red car is parked on a street, and a caption is displayed above it that reads, ""Pressure is the key to keeping your tires in good condition."" The car's tires are properly inflated, which not only ensures safety but also prolongs the life of the treads, boosts fuel economy, and improves handling. The tweet emphasizes the importance of maintaining proper tire pressure for overall vehicle performance and safety."
458,"Image describes The image shows three people sitting in front of a bookshelf, engaged in a video conference. They are all wearing headphones, and there are multiple books visible in the background. The man in the foreground is wearing glasses. The scene suggests that they are discussing or collaborating on a project or sharing information with the #FairwayNation. The tweet is likely thanking the person for their contribution to the discussion or event."
459,GIF describes A cake with white frosting and a lit candle on a white plate. Happy Gotcha Day!
460,"Image describes A police officer in a blue uniform stands in front of a building, wearing a black beret. He is wearing a badge and appears to be on duty. The officer is looking at the camera, giving a stern expression. The image is likely related to the tweet about the explosion in Katsina, as the officer may be involved in the investigation or providing security in the area."
461,Image describes A tweet about Cisco's Data Center Network Manager with a link to register for a session.
462,"GIF describes A man is standing in front of a whiteboard with math equations written on it. He is looking at his cell phone, possibly trying to understand the concept of goalie interference in hockey. The tweet suggests that he is trying to figure out the rules and calculations related to goalie interference."
463,"Image describes The image features a large 5G logo with a blue background. The logo is surrounded by a network of blue lines, giving it a futuristic and technological appearance. The caption for the tweet highlights the potential opportunities and challenges that telecom operators may face in the 5G era. The image effectively conveys the significance of 5G technology and its impact on the telecom industry."
464,"Image describes A woman is holding a baby in her arms while smiling and laughing with another woman. The baby is wearing a blue dress and a blue hat. The scene captures the joy and bond between the two women and the baby. This image could be used to celebrate the moms in one's life, as it showcases the love and care they provide to their children."
465,"Image describes A bomb explodes in a city, causing destruction and chaos."
466,"Image describes A man and a woman are posing for a picture with their sunglasses on. They are both smiling and enjoying their time together. The image is set against a backdrop of a beach, with a bench visible in the background. The couple is likely enjoying a sunny day at the beach, and the woman is wearing a pair of sunglasses. The image is being used to promote a credit card EMI option for purchasing sunglasses at LensKart, with the goal of encouraging people to use this payment method to save money."
467,"Image describes The image shows a movie poster for the upcoming Telugu film, #Akhil3. The poster features the main cast members, including BVS Prasad, Venky Atluri, Thaman S, George C. Williams, and Avinash Kolla. The movie is yet to be titled and is being directed by Venky Atluri. The poster is blue and white, with the title #Akhil3 in bold letters. The movie is set to release soon, and the crew is excited to share their latest project with the audience."
468,"Image describes Three men are smiling and posing for a picture together. They are all wearing black shirts and appear to be enjoying their time together. The photo is likely taken during the FIFA Club World Cup Qatar 2019, as the tweet suggests. The men are standing in front of a fountain, which adds to the festive atmosphere of the event."
469,"Image describes The tweet is promoting a concert event called ""The Gathering of the Worshippers"" on September 1st, 2018 at the VoorTrekker Monument. The event is in partnership with METRO FM. To win tickets for the event, participants must answer a simple question about the event's timing. The tweet includes a link to the event's website for more information. The image attached to the tweet features a sunflower and glitter, which may be related to the event's theme or aesthetic."
470,There is nothing here
471,"Image describes Two construction workers in yellow vests are working on a metal beam. They are using a wrench to tighten bolts on the beam. The image emphasizes the importance of working safely on the jobsite, as more workplace injuries tend to occur on Mondays, especially among specialty trade contractors and oil and gas pipeline workers. The tweet serves as a reminder to prioritize safety in the workplace."
472,"Image describes Jack Coan, a quarterback from Wisconsin, had a record-breaking season in 2019 with 236 completed passes for 2,727 yards and 18 touchdowns, while only throwing 5 interceptions. He led his team to the West title and a trip to the Rose Bowl."
473,"Image describes Two rhinos walking down a dirt road, surrounded by trees and bushes. The sky is cloudy, and a bird can be seen flying in the background. The image captures the beauty and majesty of these animals, reminding us of the importance of wildlife conservation."
474,There is nothing here
475,"Image describes The image features a basketball player with a unique hairstyle, holding four basketballs in his hands. The player appears to be a professional athlete, possibly a basketball player, given the context of the tweet. The tweet suggests that the player has won four MVP awards in a row, making him an exceptional athlete. The image captures the player's energy and dedication to the sport, showcasing his talent and achievements."
476,There is nothing here
