,captions
691,"Image describes A picture of flags at half mast outside the Camp Nou in honor of Diego Maradona. The flags are red and yellow, and there are two of them. The flags are flying in front of a building with a blue and red sign."
692,"Image describes The image shows a cartoon character, possibly Scorbunny, standing on a grassy field. The character has a red and white color scheme, and it appears to be smiling. The tweet is promoting the release of Pokemon Journeys on Netflix, with the voice actor expressing excitement and pride in being part of the Pokemon family."
693,"Image describes A group of engineering students is engaged in a lecture about hybrid electric vehicles and their ecological and societal benefits. The students are listening attentively as the instructor explains the importance of reducing CO2 emissions by introducing new-generation electrified vehicles. The lecture is part of the Toyota Environmental Challenge 2050, which aims to promote sustainable transportation solutions. The students are eager to learn more about the technology and its potential impact on the environment and society."
694,There is nothing here
695,"Image describes A woman is pointing at a screen with a blue background and five stars. She is smiling and appears to be happy. The caption for the image could be ""A woman pointing at a screen with five stars, indicating a positive experience or review."""
696,"Image describes The image features a man wearing a military uniform and holding a gun, possibly a prop or a toy. The man is standing in front of a wall, and the scene appears to be set in a dark room. The man is the center of attention in the image, and the overall atmosphere seems to be intense or dramatic."
697,"GIF describes The image shows a man and a woman walking down a street, with the man holding a can of soda. The woman is wearing a white tank top, and they both seem to be enjoying their time together. The man is looking at the woman, possibly engaging in a conversation. The tweet suggests that the perfect man doesn't exist, but the image shows a man who might be close to perfection, as he is holding a can of soda and walking with a beautiful woman."
698,"Image describes The image shows a large number of squares, with a red percentage sign in the middle. The sign reads 77%, indicating that 77% of decision-makers consider endpoint detection a high priority. The image also shows a caption that reads ""77% of decision-makers consider endpoint detection a high priority."""
699,"Image describes The image attached to the tweet shows a close-up of a car's gear shift, which is a part of the vehicle's transmission system. The gear shift is designed to control the gears of the engine, allowing the driver to change the speed and direction of the vehicle. The tweet is promoting the new Opel Combo, which is available with multiple engine options that offer both performance and fuel efficiency. The image of the gear shift serves as a visual representation of the vehicle's transmission system and highlights the importance of the gear shift in controlling the car's movement."
700,There is nothing here
701,There is nothing here
702,There is nothing here
703,"Image describes A brown and white dog is sitting on a sidewalk next to a statue of a dog. The dog is wearing a blue leash and appears to be looking at the statue. The scene is set in front of a building, and there are bushes nearby. The dog's position and the statue create a playful and interesting visual."
704,"Image describes A group of people are holding blue and white flags in a stadium, likely at a rugby game. The fans are excited and ready to cheer for their team. The tweet suggests that the game is taking place in RDS Arena and that fans should expect delays around Ballsbridge."
705,Image describes A glass of berry smoothie and a plate of berries on a table.
706,"Image describes A statue of Martin Luther King Jr. stands tall in the night, with his arms crossed. The quote by Martin Luther King Jr. emphasizes the importance of critical thinking and character in education. The image serves as a reminder of the significance of Martin Luther King Day and the values he stood for."
707,"Image describes A group of people, including a man wearing a black shirt and a mask, are standing together in a public space. They appear to be protesting or expressing their opinions in a public gathering. The presence of a police officer in the scene suggests that the situation is being monitored for public safety and order. The image captures the tension and emotions of the moment, as people come together to voice their concerns and make their presence known."
708,"Image describes A large room with a black wall and several paintings hanging on it. The paintings are of different sizes and colors, creating a vibrant and artistic atmosphere. The room also has a few chairs placed in the middle, inviting visitors to sit and appreciate the art. The caption for the image could be ""Explore the world of art at this month's Art Fair. Discover the beauty of different colors and styles through the paintings displayed in this large room. #QatarAirways #MoscowTogether""."
709,There is nothing here
710,"Image describes A cartoon image of a woman wearing sunglasses and a party hat with the words ""Happy New Year"" on it. The image is likely meant to convey a sense of celebration and joy for the new year."
711,"Image describes A man is standing on a stool and writing on a chalkboard in a classroom. He is teaching a class and drawing a diagram on the board. The students are sitting at their desks, paying attention to the lesson. This image highlights the dedication and hard work of teachers who strive to educate and inspire their students. The tweet celebrates these teachers and their unwavering commitment to their profession, even in challenging circumstances."
712,"Image describes A young girl is using a laptop, with the screen displaying a message about dyslexia and technology. The message emphasizes the importance of technology in empowering dyslexic children and provides a link for further information. The image conveys the idea that technology can be a valuable tool for individuals with dyslexia, enabling them to overcome challenges and achieve success."
713,"Image describes A man and woman are standing together, with the woman wearing a ring on her finger. They are both smiling and posing for a picture. The woman is wearing a white robe, and the man is wearing a white towel. The couple appears to be happy and excited about their news."
714,"Image describes A blue and yellow Asus ZenFone 5 is displayed in a close-up shot, with the phone's features and design prominently visible. The phone is available for pre-order, and customers can receive a discount of £50. The image highlights the phone's sleek design and colorful appearance, making it an attractive option for tech enthusiasts."
715,"Image describes The image is a comic strip featuring a boy and a girl. The girl is wearing a white headband, and the boy is wearing a red headband. They are both smiling and pointing at something, possibly a cell phone. The caption of the image is ""Hey, Tadokoro, since we're both here, why don't we do the thing?"". The tweet is likely referring to the comic strip and the characters' interaction with the cell phone."
716,"Image describes A woman, possibly of Native American descent, stands at a podium, giving a speech. She appears to be confident and determined, as she speaks into a microphone. The tweet suggests that she is challenging the establishment and history, aiming to become the first Native American governor. The image captures her passion and determination in the face of adversity."
717,There is nothing here
718,"Image describes A blue and white sea anemone larva is captured in a stunning image. The creature's unique appearance resembles an alien, but it is actually a marine organism. The photo was taken at the Kume Islands in Japan, showcasing the beauty of the underwater world."
719,There is nothing here
720,"Image describes A group of young girls wearing blue shirts and ties are sitting in rows, attentively listening to a speaker. They are part of the Green Girl Company, which is inspiring 1000 schoolgirls with its Raising Girls Summit. The event is taking place in a large auditorium, with many chairs and people in the audience. The girls are focused and engaged, eager to learn and grow from the experience."
721,"Image describes A man in a white shirt with a Mercedes logo on it is giving a thumbs up. He is standing in front of a black background. The man is likely a race car driver, as he is wearing a racing suit and is sponsored by Mercedes. The thumbs up gesture suggests that he is excited or happy about something related to his racing career. The tweet suggests that the man's Christmas shopping is sorted, and he is giving a thumbs up to celebrate the accomplishment."
722,"Image describes A woman is standing in front of a city skyline, looking thoughtful. She is wearing a white shirt and holding a purse. The image is likely associated with the tweet about IT operations and the quiz in the Services Showcase at Cisco Live LA."
723,There is nothing here
724,"Image describes A virus is shown in a red and yellow graphic, with the words ""Novel Coronavirus (Covid-19) Update"" written in yellow."
725,"Image describes A woman wearing glasses and a headset is smiling and laughing, likely as a co-host on a radio show. She is sitting in a chair and appears to be enjoying herself."
726,"GIF describes The image shows a microphone on a blue background, with the words ""The Micro Data Center Solutions - The Easy Button for the Edge and Branch Environments"" written below it. The image is likely related to the webinar series, emphasizing the importance of modernizing branch infrastructure and the role of micro data centers in simplifying the process."
727,"Image describes The image features a Samsung Galaxy M21 cell phone with a vibrant purple and blue color scheme. The phone is displayed on a table, and the background is orange. The tweet encourages users to match the correct price of the phone and share it on social media using the hashtags #AmazonSpecialsSamsungGalaxyM21 and #AmazonGreatIndianFestival. By participating, users have a chance to win the phone. The image is likely promoting a special offer or sale during the Great Indian Festival."
728,"Image describes A man in a black tank top and black pants stands in a room with a table full of merchandise. He is holding a beer and appears to be excitedly showing off his shirts, which say ""I came to slay."" The man is also holding a bag, possibly filled with more merchandise. The scene suggests that he is trying to promote his products and maintain a positive mindset despite the challenges he faces, such as the cancellation of an event and a lack of buyers."
729,"Image describes The image shows a house with a portable generator outside of it. The caption reads, ""At least 20 feet from the house."" This is a reminder to keep portable generators at least 20 feet away from the house to avoid the risk of carbon monoxide poisoning. The tweet emphasizes the importance of safety when using portable generators and the potential dangers associated with using them indoors or in enclosed spaces."
730,"Image describes The image features a blue cell phone, likely the new Samsung Galaxy M Series, with a purple background. The phone is positioned in a way that it appears to be charging. The caption suggests that the phone is equipped with a powerful battery, and it will be available on 28th January. The tweet also encourages users to get notified on Amazon and Samsung India websites."
731,There is nothing here
732,"Image describes A group of people holding plaques, posing for a picture. They are all smiling and proud of their accomplishments."
733,"GIF describes A man wearing a red jacket is riding a horse. He is wearing a helmet and appears to be participating in a competition. The image is likely related to the tweet about the Nations' Cup for Team Canada, where they finished in second place with a total of 13 faults."
734,There is nothing here
735,Image describes A man wearing a white shirt and a gold crown is sitting on a gold throne. He is smiling and appears to be in a position of authority. The image could be interpreted as a representation of a king or a leader in a position of power. The tweet about the engineering college might suggest that this man is being honored or celebrated for his contributions to the field of engineering or his leadership qualities.
736,"Image describes The image shows a group of four men sitting in director's chairs on a stage, engaged in a conversation. One of the men is Michael Palin, who is reminiscing about the challenges they faced while making a movie. The other three men are also sitting in chairs, listening to Michael's story. The scene captures the camaraderie and shared experiences of the group, reflecting the challenges and triumphs of filmmaking."
737,There is nothing here
738,"Image describes The image shows a man standing in front of a large screen, which has the Google Cloud logo on it. The man appears to be giving a presentation or discussing the topic of the Google Cloud. The tweet suggests that the company has a large network of partners and engineers, which could be an important aspect of their business or operations."
739,There is nothing here
740,Image describes A man wearing glasses and a suit is smiling for the camera. He is the head of Network Solutions at MOAI and is speaking about the impact of 5G on the Industrial Internet. The image is a part of a tweet that includes a hyperlink to the full story.
741,"GIF describes A woman in a red suit is standing in a ring, holding a microphone and announcing her pregnancy. She is surrounded by other people, including a man in a black shirt and another man in a red shirt. The woman's announcement is a significant event, as she is breaking barriers and showing her baby how to do the same. This moment is being captured on a television show called ""Total Divas."""
742,There is nothing here
743,There is nothing here
744,There is nothing here
745,There is nothing here
746,There is nothing here
747,"Image describes A person is holding a cell phone with the Facebook app open, displaying a tweet that says ""Facebook Not Against Countries Regulating Social Media"". The tweet includes two hyperlinks, which provide additional information or context to the statement. The image captures the moment when the person is reading or interacting with the tweet on their phone."
748,There is nothing here
749,"Image describes The image shows a group of young men celebrating in a room, with some of them holding up their hands. They are wearing yellow and black shirts, and there is a TV in the background. The atmosphere appears to be joyful and triumphant, as they have likely achieved a significant victory or accomplishment. The tweet is likely referring to the grand finals of a competition or event, and the hashtag #GONAVI suggests that they are supporting a team or individual named GONAVI."
750,There is nothing here
751,"Image describes A group of people wearing yellow vests are gathered around a fountain in Paris, with some of them kneeling down. The scene appears to be a protest or a gathering, as the crowd is blocking the water fountain. The presence of police officers suggests that there might be a clash between the protesters and the authorities. The image captures the tension and conflict between the two parties in the city."
752,"Image describes Two men wearing face paint, one with a British flag and the other with a Croatian flag, are smiling and posing together. They seem to be friends despite their countries being rivals in a sports competition. This image represents the spirit of sportsmanship and camaraderie between fans of different teams."
753,"Image describes Volkswagen has partially won a legal battle against a seat supplier. The company was seeking damages due to the supplier's alleged failure to deliver seats on time. The court ruled in favor of Volkswagen, but the amount of damages has not yet been determined. This victory could have implications for other legal disputes involving the company."
754,"Image describes The image shows three men wearing face masks and standing next to each other. The caption suggests that the country should not be held back by individuals who have taken the government to court to challenge lockdown regulations. The image could be related to the ongoing COVID-19 pandemic and the importance of following safety measures, such as wearing masks, to prevent the spread of the virus."
755,There is nothing here
756,There is nothing here
757,"Image describes A woman in a suit stands in front of a group of people, giving a presentation. She is wearing a green shirt and a white blazer. The group is seated in chairs, with a laptop on the table in front of them. The woman is talking and gesturing with her hands, engaging the audience. The scene suggests a professional setting where the woman is discussing supplier standards and diversity."
758,There is nothing here
759,"Image describes A man in a suit is holding a gold soccer trophy, smiling and showing off his award. He is wearing a tie and appears to be a professional athlete. The trophy is a large gold soccer ball, signifying his achievement in the sport. The man's accomplishment is being celebrated, and he is proudly displaying his award to the world."
760,"Image describes The image features a large cityscape with a prominent building in the background. The city is connected with a network of Wi-Fi and 5G technology, showcasing the importance of these technologies in modern urban environments. The image highlights the role of managed services in providing reliable and efficient connectivity to the city's residents and visitors."
761,There is nothing here
762,"Image describes A man wearing glasses and a suit is smiling in front of a blue background. The background features the BlackBerry logo and the phrase ""BlackBerry: Secure. For real."" The man appears to be the CEO of BlackBerry, John Chen, who is promoting the company's focus on securing infrastructure for smart cities."
763,"Image describes A woman wearing a red scarf and a furry hat is standing in the snow. She is bundled up and appears to be enjoying the winter weather. The tweet encourages people to bundle up in layers to stay warm, check on elderly family and neighbors to ensure they have adequate heat, and bring in their pets."
764,"Image describes A woman in a gold outfit is singing on stage, surrounded by a crowd of people. The woman is holding a microphone and appears to be the main focus of the image. The audience is engaged and enjoying the performance. The scene suggests that the woman is a performer at an event, possibly at Booma Grounds in Fort Portal."
765,"Image describes A man wearing a black hat and a red tie is looking at the camera. He appears to be a businessman or a politician. The image is likely related to the tweet about a group protesting at the US and UK embassies, demanding a visa ban on Supreme Court judges. The man's attire and the context of the protest suggest a connection between the two."
766,There is nothing here
767,"Image describes A man is lighting candles in front of a memorial for a protester who died. The image captures the solemn atmosphere of the tribute, with the man wearing a white shirt and a face mask, possibly to protect himself from the virus. The scene is set in a crowded area, with multiple people present, some of whom are wearing face masks as well. The man is focused on the task at hand, showing respect and remembrance for the fallen protester."
768,There is nothing here
769,"Image describes The image features a close-up of a Target dart with a black and orange design. The dart is equipped with a Black Point for steel-tip or pixel tip for soft-tip, a Target Pro Grip shaft, and a new Vision Ultra RVB Black flight. This stunning dart has been specifically designed to complement the RVB 80% Black dart."
770,There is nothing here
771,"Image describes A basketball player in a white jersey is holding a basketball and looking up, possibly at the scoreboard. He is surrounded by other players on the court. The tweet is about Carlos Delfino, who scored 27 points in a game, which is a game high. The tweet also includes a hyperlink at the top of the thread, which likely leads to more information about the game or the player."
772,"Image describes Astronauts will film lessons on the International Space Station, honoring Christa McAuliffe's dream of teaching from space."
773,"Image describes Two men wearing suits and ties are sitting in front of a microphone, likely discussing a basketball game. One of the men is wearing glasses. The image is likely from a TV broadcast, as the men are described as being on TV. The tweet mentions that the man knows the game of basketball well and is passionate about it."
774,"Image describes President Obama and his daughter Malia are walking together, and the president is smiling. Twitter is wishing Malia a happy 21st birthday."
775,There is nothing here
776,There is nothing here
777,There is nothing here
778,"Image describes A man in a military uniform stands next to a woman in a black shirt. The man is wearing a hat and a tie, while the woman is wearing a black shirt. They are both looking straight ahead."
779,Image describes A woman with long hair is looking at the camera. She is wearing a striped shirt and appears to be the focus of the image. The photo is likely associated with a tweet about a fashion event or a Tommy Hilfiger promotion.
780,"Image describes A group of people are standing outside a building, with some of them holding up their hands. They are protesting and showing their support for Joshua Wong, who is a political activist. The group is chanting slogans and expressing their opinions on the situation. The image captures the spirit of unity and determination among the protesters."
781,"Image describes A man and a woman are smiling and posing for a picture. They are both wearing blue shirts and appear to be enjoying each other's company. The man has his arm around the woman, and they are standing close to each other. This image could be used to illustrate the importance of long-term care and the need for financial planning to cover the costs associated with it. The tweet suggests visiting a website to learn about options for covering these expenses."
782,There is nothing here
783,"Image describes A smiling man in a suit and tie, likely Magnus Ewerbring, is the subject of the image. He is discussing the importance of AI in enhancing network performance in a 5G world. The man appears to be confident and knowledgeable about the topic, making him an expert in the field. The image conveys a sense of professionalism and expertise, which is fitting for the context of the tweet."
784,"Image describes The image features a close-up of a red and black headset, specifically a red and black A40 TR headset. The headset has a unique design on the front, making it stand out. The headset is placed on a black background, which further emphasizes its vibrant colors."
785,"Image describes The image shows a forest with a hazy sky, and there are several black dots scattered throughout the scene. The dots are labeled as tar balls, which are commonly found in wildfires. The tar balls are described as forming fractal-like aggregates, suggesting a complex and interconnected structure. The image highlights the impact of wildfires on the environment and the importance of understanding and addressing this issue."
786,There is nothing here
787,"Image describes A man playing a guitar on stage, singing a song about Jesus. The lyrics of the song are displayed on the screen behind him."
788,"GIF describes A man with a beard and mustache is standing in a forest. He is wearing a blue jacket and has a serious expression on his face. The caption of the image is ""Does pig shit stink?""."
789,Image describes A gold Star Wars coffee mug with the Lucasfilm logo on it.
790,"Image describes A glass of champagne is displayed in front of a black background, with the words ""Rising Star"" written in gold. The image is promoting the #FDFAwards, which are sponsored by a company. The tweet encourages people to apply for the ""Rising Star"" award before the deadline, which is next week. The image and tweet are likely promoting the awards and inviting entries from individuals in the food and drink industry."
791,"Image describes The image shows a border crossing with a large ""America"" sign on top of a booth. The booth is closed, indicating a border closure. The closure is expected to be extended for another 30 days, as officials have announced. The image highlights the impact of the border closure on travel and trade between Canada and the United States."
792,There is nothing here
793,"GIF describes A robot with a face and a pair of horns is shown, with the words ""Let's do this!"" written on the image. This image is likely related to the Twitter Chat starting on Wednesday."
794,There is nothing here
795,There is nothing here
796,There is nothing here
797,"Image describes The image features a split-screen of two women, both with blonde hair. The left woman is wearing a green shirt, while the right woman is wearing a black shirt. The image is likely related to a darts competition, as the tweet suggests. The two women are the top seeds in the competition, and this is their first ever world finals. The tweet is promoting the event and using the hashtag #TeamTarget and #LakesideDarts."
