,captions
169,"GIF describes The image attached to the tweet is a poster of Star Wars: The Force Awakens. The poster features the main characters of the movie, including Rey, Finn, and Kylo Ren. The poster also includes the iconic Star Wars logo and the movie's title. The tweet celebrates the Star Wars franchise and its impact on popular culture, as well as the technology used in the movies. The two hyperlinks in the tweet likely lead to more information about the franchise or the technology used in the films."
170,"Image describes The image shows a man standing in front of a bookshelf, with a book open in front of him. The man is wearing a tie and appears to be focused on the book's content. The scene suggests that he is engaged in reading or studying, possibly related to the budget or financial matters."
171,"Image describes A group of people sitting around a table playing a game, with a map on the table. They are smiling and enjoying themselves. The game appears to be a board game, possibly related to science or education. The group is engaged in a fun and interactive activity, which could be a part of the Science in a Box programme."
172,"Image describes A man is driving a car with a group of people in the back, all smiling and enjoying the ride. The car is moving fast, and the passengers are waving their hands in the air. The man is wearing a hat and sunglasses, adding to the fun and excitement of the moment. This image captures the essence of a spring break adventure, where the driver and his friends are taking advantage of the waived young renter fee offered by Hertz. The image conveys a sense of freedom, adventure, and camaraderie among the group, as they embark on their journey together."
173,There is nothing here
174,"Image describes A man in a black shirt is holding up a pair of purple women's underwear. He is standing in front of a blue wall. The man appears to be the focus of the image, and the underwear is the main subject of the photo."
175,"Image describes A racing car is shown on a track, with the driver inside. The car is labeled ""Williams"" and is currently in fifth place. The driver is focused on the race, and the car is moving at high speed. The image captures the excitement and competitive atmosphere of the Hungarian Grand Prix."
176,"Image describes A man is standing in a workshop, surrounded by various tools and sculptures. He is holding a towel and appears to be working on a project. The workshop is filled with different types of tools, including scissors, knives, and a clock. The man seems to be focused on his task, possibly creating a piece of art or working on a commissioned project. The scene suggests that the man may be a Cuban sculptor, and he is likely at ""The Art Factory"" to dine and party with others who share his passion for art and creativity."
177,Image describes A man in a suit and tie is sitting at a desk with a laptop and mouse. He has a Batman sticker on his laptop and is smiling. The man is the Director of Innovation at a company.
178,"Image describes The image shows a dashboard displaying various statistics about Microsoft Teams usage. The dashboard includes graphs and charts that provide insights into the number of active users, meeting minutes, and message activity. The data is presented in a clear and concise manner, making it easy for users to understand the performance of their Microsoft Teams environment. The tweet announces the general availability of Microsoft 365 usage analytics in Power BI, which allows users to monitor and optimize their Teams usage effectively."
179,"GIF describes A man in a red shirt is holding up a red and white jersey with the name David Luiz on it. He is smiling and appears to be proud of the jersey. The man is standing in front of a red and white sign, which could be a logo or a symbol representing his team or favorite player. The tweet suggests that Virgil van Dijk could learn from David Luiz's defensive skills and techniques."
180,"Image describes A man and woman are standing next to each other, both wearing sunglasses. The woman is wearing a black dress, while the man is dressed in a suit. They are posing for a picture, and the woman is smiling. The man is sticking his tongue out, adding a playful element to the photo. The tweet is likely a celebration of the woman's recovery and a way to show support and love from the man."
181,"Image describes ""Two women in red dresses are shown in a split image. Charlize Theron and Margot Robbie are the stars of the movie, which has been nominated for two Golden Globes. The movie is now playing in theaters."""
182,"Image describes A seashell is laying on the sand at the beach, with the ocean in the background. This image captures the essence of the beach and the sea, making it a perfect fit for the #motography theme of By The Beach."
183,"Image describes A group of women wearing red jerseys are standing on the ice, with a coach pointing at a whiteboard. The coach is likely explaining the game strategy to the players. The scene captures the intensity and focus of the women's hockey team as they prepare for their match."
184,There is nothing here
185,"Image describes A man and woman are holding a box of chocolates, while a man in a white shirt is handing them a gift. The woman is wearing a scarf. The group appears to be happy and appreciative of the gesture."
186,"Image describes A man in a suit and tie is standing in front of a building, looking confident and poised. He is wearing glasses and appears to be the focus of the image. The man is likely a fund manager, as he is being interviewed on a show called ""The Markets."" The show is being broadcasted on ET Now, and the man is likely discussing market trends and investment strategies. The image captures the man's professional demeanor and expertise in the financial industry."
187,"Image describes Justin is in a dark place, everyone."
188,There is nothing here
189,There is nothing here
190,"Image describes The image features a laptop screen with a video of three people talking about the future of work. The video is titled ""Future of Work."" The people in the video are Jean-Pierre Overbeek, CEO of Econcom, Kim Grondsma, Program Manager at BZK, and a third person. The video is likely discussing trends and changes in the work landscape in response to the events of 2020."
191,There is nothing here
192,"GIF describes Two men are standing in a hallway, one with a mustache and the other with curly hair. The man with the mustache is saying ""Hello. What have we here?"". The other man is looking at him with a surprised expression. The image is likely related to the tweet about the Empire Strikes Back returning to AMC Theatres."
193,There is nothing here
194,"Image describes A man and a woman are shopping in a store. The man is holding a red wallet, and the woman has a handbag. They are surrounded by various bags and purses. The image suggests that the retailer is using a showroom to attract customers and promote their products. The tweet highlights how retailers can adapt to the changing shopping habits of consumers by incorporating showrooms and other strategies."
195,There is nothing here
196,"Image describes The image shows a red and white bag with a yellow tag on it, which says ""Big Mac"" and ""McDonald's"". The bag is placed on a table, and the tag is attached to the top of the bag. The tweet ""Mission Failed boys <hyperlink>"" suggests that the person who posted the tweet might be disappointed or frustrated about something related to the content of the tweet. However, without more context, it is difficult to determine the exact reason behind the tweet."
197,"Image describes A book is open to a page with the title ""Challenges on Database"". The book is placed on a desk next to a keyboard."
198,"Image describes A man and a woman are standing together, dressed in costumes, and appear to be posing for a photo. They are both wearing boots and the woman is wearing a hat. The man is wearing a jacket and a necklace. The image is likely related to the JaDine concert 'Revolution' and its extended nationwide tour."
199,"Image describes A basketball player is seen in action, reaching for the ball during a game. The player is wearing a white jersey and is in the process of throwing the ball. The image captures the intensity and excitement of the sport, with the player's determination to make a successful play."
200,There is nothing here
201,"Image describes A group of men are seen holding sticks and shouting in a crowd. They appear to be protesting or engaging in a confrontation with the police. The scene is chaotic and tense, with the men standing close to each other and expressing their anger or frustration. The situation seems to be escalating, and it is unclear what the underlying cause of the conflict is."
202,"Image describes The image shows a live stream of a press conference featuring Toyota and SoftBank. The stream is set to start at 13:30 JST. The image also includes logos for both companies, emphasizing their collaboration. The event is likely to discuss their joint ventures or announcements."
203,"Image describes A group of protesters in Hong Kong have been charged with riot after being arrested over the weekend. They will be taken to the West Kowloon Magistracy for a hearing on their bail applications on Tuesday afternoon. Last week, 96 defendants were charged with riot in a single day. The ongoing protests in Hong Kong are against the Extradition Law Amendment Bill (ELAB)."
204,There is nothing here
205,There is nothing here
206,"Image describes A statue of a little mermaid in Copenhagen has been vandalized with graffiti. The words ""racist fish"" have been spray-painted on the monument's base. The statue is a popular tourist attraction and is located near the water. The vandalism has sparked controversy and debate about the statue's meaning and its place in the city."
207,Image describes A diagram of a heart with labels showing the different parts and how they work together.
208,There is nothing here
209,There is nothing here
210,"Image describes A man is holding a small blue and pink object, possibly a toy or a game controller, and smiling. He is wearing a gray sweatshirt and appears to be happy. The tweet suggests that the man chose a cotton candy combo, and the image is likely related to that choice. The man's smile and the object he is holding could be a representation of the enjoyment he gets from the cotton candy combo."
211,There is nothing here
212,There is nothing here
213,There is nothing here
214,"Image describes The image shows a group of people gathered at a ribbon-cutting ceremony for a new metro station. Two people, Vandana P.S and George C.G, are cutting the ribbon with scissors. The crowd, including a man wearing a face mask, watches the ceremony. The event is being held at the Ernakulam South Metro Station. The presence of the face mask suggests that the event is being held during a pandemic, and the attendees are taking precautions to protect themselves and others."
215,"Image describes A man in a blue shirt is working on a machine, possibly a pump or motor. He is wearing a name tag and appears to be focused on his task. The image suggests that he is a sole breadwinner in a large family, and he is working hard to provide for his children. The tweet promotes the #ICICIAcademyForSkills, which aims to help people like Imran Mohammed improve their skills and secure better futures for themselves and their families."
216,There is nothing here
217,Image describes A loaf of banana bread is baking in the oven. The bread is placed in a pan and covered with a piece of wax paper. The banana bread is golden brown and ready to be taken out of the oven.
218,"Image describes The image features a collage of people wearing yellow face masks, which is the symbol of the new solidarity campaign called #UnmaskTheTruth. The campaign aims to show support for journalists who face censorship, arrest, and attacks for reporting the truth. The collage consists of various people, including men and women, of different ages and backgrounds, all wearing the yellow face masks. The image conveys a message of unity and solidarity in the face of challenges to freedom of expression."
219,"Image describes A man in a suit is standing in front of a podium, giving a presentation. He is wearing a microphone and appears to be discussing the challenges faced by IT departments as they adopt digital business transformation. The image captures his passion and expertise on the topic."
220,"Image describes A young man is standing in front of a theater with a sign that says ""Mean Girls."" He is wearing a black jacket and has his arms outstretched. He is excited to be making his Broadway debut in the show."
221,There is nothing here
222,"Image describes A man and woman are sitting together at a table, both holding cups of coffee. They are smiling and enjoying each other's company. The man is wearing a sweater and the woman has blonde hair. The scene captures a moment of happiness and connection between the two individuals, reminiscent of the awe-inspiring experience at St Francis' Hospice."
223,There is nothing here
224,"Image describes The image features two luxury cars, one red and one blue, parked in front of a large building. The caption suggests that these cars are fuel-cell vehicles, and the tweet is promoting the second-generation Mirai, a fuel-cell vehicle. The tweet emphasizes the importance of designing and building better cars for the future."
225,"Image describes A fox kit snuggles up to its mother in a heartwarming scene captured by Your Shot photographer Morio Okubo in Asahikawa, Japan. The image captures the tender bond between the mother and her cub, showcasing the affection and care that the mother provides to her young. The scene is set in a natural environment, with the mother and her cub standing close to each other, surrounded by leaves and dirt. This image serves as a reminder of the beauty of nature and the importance of preserving the habitats of these majestic creatures."
226,There is nothing here
227,Image describes A gray and black Asus speaker on a wooden table. The speaker is designed to work with Alexa and is a smart home device.
228,"Image describes A man in a black jacket stands on a stage, singing into a microphone. He is surrounded by a crowd of people, some of whom are holding cell phones. The man appears to be the main focus of the scene, and his performance seems to be the center of attention. The tweet ""Sing when you're winning"" suggests that the man is a successful performer, and the image captures a moment of his triumph on stage."
229,"Image describes The image shows a logo for the Nigeria Employers' Consultative Association (NECA). The logo is blue and white, and it is placed on a white background. The logo is accompanied by the text ""Nigeria Employers' Consultative Association."""
230,There is nothing here
231,"Image describes A man in a suit and tie is standing in front of a city skyline. He is wearing a flag pin on his lapel and appears to be giving a speech or making a statement. The man is likely a politician or a public figure, as he is dressed formally and appears to be addressing an important issue. The image conveys a sense of authority and professionalism, as the man is well-dressed and confidently presenting his message."
232,"Image describes The image captures a rugby match where two teams are playing. One player is attempting to score a try by running with the ball, while another player tries to stop him. The scene is intense and action-packed, showcasing the athleticism and skill of the players involved. The tweet is likely referring to a specific moment in the game where the player is trying to score a try, and the teams are competing against each other."
233,"Image describes A family poses for a picture on a baseball field. The family consists of a man, a woman, and their children. The woman is holding a baby. The man is wearing a blue shirt, and the woman is wearing a red shirt. The children are wearing baseball uniforms. The family is posing for a picture to celebrate Mother's Day."
234,"Image describes A red panda is sitting on a black background, looking directly at the camera. The panda is a small, furry creature with a distinctive ringed tail. The image captures the beauty and vulnerability of this at-risk species, highlighting the importance of conservation efforts to protect their habitat and ensure their survival."
235,"Image describes A girl with a bow in her hair is making a funny face and looking at the camera. She has a surprised expression on her face, possibly reacting to something unexpected or amusing. The image is likely related to the tweet, which congratulates someone named Megumi for their achievement."
236,There is nothing here
237,There is nothing here
238,There is nothing here
239,Image describes A beautiful woman wearing a green dress is displayed on the cover of a magazine. The image is used to advertise a 15% discount on online shopping at Kalki Fashions using an ICICI Bank credit or debit card. The tweet encourages people to use the discount and enjoy the benefits of shopping at Kalki Fashions.
240,Image describes A shirtless man with a tattoo on his arm is holding a red hair dryer in front of a mirror. He is making a funny face and appears to be singing into the hair dryer. The image is likely meant to be humorous and entertaining.
241,"Image describes A red, white, and green umbrella with the letters PDP on it."
242,"Image describes The image shows a man wearing a suit and tie, possibly Arnab Goswami, looking into the camera. The man is wearing glasses and appears to be in a professional setting. The tweet suggests that Arnab Goswami and his wife have withdrawn their pleas seeking protection from arrest in a case involving obstructing police officers."
243,Image describes A tweet congratulating ShopRite for being named one of the top customer service retailers in the country. The tweet thanks the Customer Care Team and store associates for their commitment to customer service.
244,"Image describes A large screen displays a presentation for an IoT Innovation Talk. The screen shows a slide with the words ""Imagine Intuitive"" in blue and white. The presentation is about to begin, and the speaker will discuss extending Intent-Based Networking to the edge and how customers are using DevNet resources to extend apps to the edge."
245,GIF describes A man in a striped shirt is making a funny face and holding his chest. He appears to be surprised or excited.
246,"Image describes A group of people are standing together, posing for a picture. They are all smiling and appear to be enjoying themselves. One person in the group is holding a wine glass, suggesting that they might be at a social event or gathering. The group consists of both men and women, and they are all dressed up, indicating a special occasion or celebration. The tweet is likely referring to the enjoyable time they had together at this event, and the mention and hyperlink could be related to the location or details about the event."
247,"Image describes A man wearing a purple hat and a purple robe is smiling for the camera. He is likely a graduate or a professional in his field. The image is a close-up of the man's face, showcasing his attire and the purple hat."
248,There is nothing here
249,"Image describes A man in a blue shirt and tie is sitting at a desk with a takeout box of food in front of him. He is smiling and appears to be enjoying his meal. The image suggests that the office has ordered takeout from a local restaurant, supporting the local businesses. The tweet encourages others to do the same and highlights the importance of supporting local restaurants and businesses."
250,"Image describes A black and white photo of a flag waving in the wind, with boats in the background. The image captures the spirit of the Allied Forces during World War II."
251,GIF describes A football field with players in blue and white uniforms. The players are lined up and ready for the next play. The field has a red and white logo in the middle.
252,"Image describes A man wearing glasses and a hat is looking downward. He is wearing a white shirt and a blue hat. The man appears to be in a crowd of people, possibly attending an event or gathering. The image captures the man's focused expression as he looks down, possibly observing something or someone in the crowd."
253,"Image describes A man is smiling and laughing while holding a cell phone. He is wearing glasses and a white shirt. The image is promoting Airtel DataPlus, which offers 1GB of data and N2,000 airtime for just N1000. The offer is valid for 14 days."
254,"Image describes A person holding a cell phone and a laptop with the message ""Now you can track the status of your deliverables such as cheque books, credit cards and bank statements all with ease using the #ICICIBank iMobile app or internet banking. Know more here: <hyperlink> <hyperlink>""."
255,Image describes A tweet about the Kano University of Science and Technology suspending lectures indefinitely due to the COVID-19 pandemic.
256,There is nothing here
257,"Image describes A man wearing glasses and a hat is looking at the camera. He is wearing a white shirt and a hat with a blue and white pattern. The man appears to be the subject of a news story, possibly related to the tweet about cronyism and bias in appointments."
258,There is nothing here
259,Image describes Air Canada has confirmed that it will comply with Transport Canada's safety notice closing Canadian airspace to Boeing 737 MAX aircraft operations until further notice. Passengers can rebook their flights by following the guidelines provided in the attached statement.
260,GIF describes A young boy with a frowning expression on his face.
261,"GIF describes A man in a suit and tie is sitting at a desk with a nameplate in front of him. He is speaking into a microphone, possibly during a hearing or a meeting. The man is wearing a blue suit and a blue tie, and he appears to be focused and engaged in the discussion. The image suggests that the man is a public figure or a professional, possibly a politician or a lawyer, given his attire and the context of the scene."
262,"Image describes A tweet advertising the benefits of the AMC Stubs program, which offers discounts and rewards for movie-goers. The program includes $5 popcorn and Coke cameo combos on Tuesdays, as well as other perks and points for visiting the theater."
263,There is nothing here
264,Image describes A black iron fence separates the waterfront from the land. The fence is located near a boat docking area.
265,"Image describes A man in a military uniform, possibly an Iranian soldier, is staring into the camera with a stern expression. He is surrounded by other military personnel, some of whom are also wearing uniforms. The image suggests a serious and focused atmosphere, possibly related to the killing of Iran's Soleimani."
266,There is nothing here
267,"Image describes A man in a suit is speaking into a microphone, possibly discussing the harmful effects of the war on drugs and the need to end pre-employment marijuana testing. The image is accompanied by a tweet about the man's bill to ban such testing and the ongoing issues surrounding the war on drugs, particularly in black and brown communities."
268,"Image describes The image shows a woman with a surprised expression, possibly due to the tweet's content. The tweet itself is a comment on President Trump's weight, suggesting that he does not look like a monkey. The image of the monkey is a visual representation of the tweet's content, and it is placed next to the woman's picture. The caption of the media could be something like ""A tweet about President Trump's weight, accompanied by an image of a monkey."""
269,Image describes A man with a black shirt and a white arm brace is sitting down with his head in his hands.
270,"Image describes A pothole is shown on a road, with water filling the hole. The pothole is surrounded by dirt and rocks, and it appears to be a significant issue for the road. The image highlights the issue of crumbling roadways and the costs associated with repairing pothole damage for American drivers."
271,There is nothing here
272,"Image describes A yellow and blue logo for MOSOP, which stands for the Movement for the Actualization of the Sovereign State of Biafra. The logo features a blue and green flag with stars and stripes, representing the sovereignty and unity of the Biafran people. The caption for the image is ""MOSOP Announces Transitional Council."""
273,There is nothing here
274,"Image describes A basketball player in a red and blue jersey is holding his arms up in the air, celebrating a victory. The scoreboard shows the final score of 82 to 66, with the player's team winning. The image captures the excitement and triumph of the moment."
275,"Image describes A woman in a red coat and hat is walking down a snowy street, carrying a child in a carrier. She is smiling and appears to be enjoying the winter weather. Another woman is standing nearby, also smiling and enjoying the snow. The scene captures the spirit of community and camaraderie during a snowstorm."
276,"Image describes A flag with a red and blue background and a white star on it is flying in the wind. The flag is the state flag of Mississippi, which is the only state flag in the United States to feature the Confederate emblem. The Mississippi State House has recently passed a resolution to change the flag, which will begin the process of updating the flag design."
277,"Image describes A person is wearing white sneakers with a black logo on the side. The shoes are laced up and the person is standing on a white surface. The shoes are the main focus of the image, and they appear to be comfortable and stylish."
