,captions
0,"GIF describes The image is a cartoon depiction of two characters, one of which is a yellow dog, standing on a road. The dog is punching the other character, who is a boy. The scene is set in a colorful environment, possibly a fairy tale or fantasy world. The caption of the image is ""Trust Pound!"", which could be a playful or humorous reference to the characters' actions in the scene."
1,"Image describes A collage of four photos of Michigan basketball players celebrating a great season. The caption reads ""Thanks for a great season!"""
2,"Image describes A group of people, including a woman wearing a red outfit, are standing together in front of a sign. They are posing for a picture, likely at the Paralympic Athlete Village. One of the individuals in the group is Natalie Wilkie, a bronze medalist in the women's cross-country 1.5 km standing sprint. She is the youngest team member and is proudly representing her country."
3,"GIF describes A man in a suit and tie is sitting in a plane, looking out the window. He is wearing a tie and a suit jacket, and he appears to be looking at something or someone outside the plane. The image could be related to the tweet about the assistant manager of Sweden's comment on England's ""it's coming home"" talk, but it is not clear how the two are connected."
4,"Image describes The image shows a close-up of a red and white cell, possibly a virus or a cellular structure. The image is described as a ""red and white virus"" and is likely related to the tweet about Texas inmates testing positive for COVID-19. The image could be used to illustrate the concept of the virus and its impact on the inmates and the community."
5,"Image describes A Hong Kong police officer is seen holding a gun in a video, as mass arrests are being conducted in Mong Kok. The clashes between protesters and police continue into the night."
6,"Image describes A blue SUV is on display at an event, with a speaker standing in front of it. The speaker is presenting the features and highlights of the new RAV4, which is built with the Toyota New Global Architecture (TNGA). The event showcases the SUV created #4TheBrave."
7,"Image describes A series of fossilized human bones, including a finger, are displayed on a black background. These bones are from the Arabian Peninsula and could challenge the widely accepted theory of human migration out of Africa."
8,"Image describes The image attached to the tweet features a group of people engaged in various activities, showcasing the importance of community involvement. The scene includes individuals working together, participating in events, and interacting with each other. The image highlights the significance of collaboration and investment in one's community, which is emphasized in the tweet's message."
9,"Image describes A soccer player named Wan-Bissaka is shown in action on the field, kicking the ball with his foot. He is wearing a red jersey and is surrounded by other players. The image captures the intensity and skill of the sport, as the players compete against each other."
10,"Image describes The image shows a man in a white shirt and a blue hat, sitting in a chair and speaking into a microphone. He appears to be a politician, possibly addressing a gathering or event. The caption suggests that the politician, Tambuwal, is supporting security agencies and working with the federal government to address insecurity issues. The image captures a moment of his speech, where he is actively engaging with the audience and discussing important matters."
11,Image describes A man and woman are shaking hands in an office setting. The man is wearing a green shirt and the woman is wearing a white shirt. The office has a desk with a laptop and a potted plant. The caption suggests that the app experience is important for organizations and that they should rethink their cloud operations for the era of modularity.
12,"Image describes A large group of people are sitting in an auditorium, listening to a speaker. The speaker is addressing the doctors and members of the Indian Medical Association in Surat, discussing investor behavior in equities and the opportunities associated with it. The audience appears to be engaged and attentive, as they gather to hear the speaker's message."
13,"Image describes A football is displayed with the words ""Bill Belichick 200"" written on it. The football is in a case, and there is a plaque next to it. The plaque has the words ""Bill Belichick Celebrates 200"" written on it."
14,"Image describes The image features a laptop computer with a purple background, showcasing the Republic of Gamers (ROG) Zephyrus S. The laptop is equipped with a GeForce RTX 2070 GPU and a 9th Gen Intel Core i7 processor, providing a powerful gaming experience. The display boasts a no-compromise up to 240Hz/3ms refresh rate, ensuring smooth gameplay. Additionally, the laptop has Pantone Color Validation, ensuring accurate color representation. and the video's audio describes"
15,"Image describes A close-up of a black and orange case with a white A on it, containing various electronic equipment. This case represents the cutting-edge technology of Smart Pneumatics, which can revolutionize the way you work. Visit booth B71 in hall 11 at IFFA 2019 to learn more and upgrade your work processes."
16,"Image describes Two men wearing Santa hats are smiling and petting a dog. The dog is wearing a Santa hat as well. The scene is joyful and festive, highlighting the importance of giving back to animals during the holiday season. The image is a reminder of the impact that donations can have on the lives of pets in need."
17,"Image describes A woman is shown in the image, holding her hand out, with the caption ""Get your boss off your back. Buy any amount of data you want and your bundles never expire. Now that's Flexi. #WeDey4U, everywhere you go. #MTNFlexiBundles <hyperlink>"". The image is likely meant to convey the idea of being able to purchase data without restrictions, as the woman's hand is reaching out, possibly to grab the data. The tweet is promoting the flexibility of the MTN Flexi Bundles, which allow customers to purchase any amount of data they want without worrying about expiration."
18,"Image describes Four men are standing together in front of a large screen, smiling and posing for a picture. They are all dressed in business attire, with two of them wearing ties. The group appears to be enjoying their time together, possibly discussing important legislative issues or visiting the trading floor in Plano. The image captures a moment of camaraderie and collaboration among the men."
19,"GIF describes A man in a suit is standing in front of a window, holding a microphone and speaking into it. He appears to be making a speech or giving a lecture. The caption of the image reads, ""And there in your wrongness and there in your wrongness and there in your wrongness and there in your wrongness and there in your wrongness and there in your wrongness and there in your wrongness and there in your wrongness and there in your wrongness and there in your wrongness and there in your wrongness and there in your wrongness and there in your wrongness and there in your wrongness and there in your wrongness and there in your wrongness and there in your wrongness and there in your wrongness and there in your wrongness and there in your wrongness and there in your wrongness and there in your wrongness and there in your wrongness and there in your wrongness and there in your wrongness and there in your wrongness and there in your wrongness and there in your wrongness and there in your wrongness and there in your wrongness and there in your wrongness and there in your wrongness and there in your wrongness and there in your wrongness and there in your wrongness and there in your wrongness and there in your wrongness and there in your wrongness and there in your wrongness and there in your wrongness and there in your wrongness and there in your wrongness and there in your wrongness and there in your wrongness and there in your wrongness and there in your wrongness and there in your wrongness and there in your wrongness and there in your wrongness and there in your wrongness and there in your wrongness and there in your wrongness and there in your wrongness and there in your wrongness and there in your wrongness and there in your wrongness and there in your wrongness and there in your wrongness and there in your wrongness and there in your wrongness and there in your wrongness and there in your wrongness and there in your wrongness and there in your wrongness and there in your wrongness and there in your wrongness and there in your wrongness and there in your wrongness and there in your wrongness and there in your wrongness and there in your wrongness and there in your wrongness and there in your wrongness and there in your wrongness and there in your wrongness and there in your wrongness and there in your wrongness and there in your wrongness and there in your wrongness and there in your wrongness and there in your wrongness and there in your wrongness and there in your wrongness and there in your wrongness and there in your wrongness and there in your wrongness and there in your wrongness and there in your wrongness and there in your wrongness and there in your wrongness and there in your wrongness and there in your wrongness and there in your wrongness and there in your wrongness and there in your wrongness and there in your wrongness and there in your wrongness and there in your wrongness and there in your wrongness and there in your wrongness and there in your wrongness and there in your wrongness and there in your wrongness and there in your wrongness and there in your wrongness and there in your wrongness and there in your wrongness and there in your wrongness and there in your wrongness and there in your wrongness and there in your wrongness and there in your wrongness and there in your wrongness and there in your wrongness and there in your wrongness and there in your wrongness and there in your wrongness and there in your wrongness and there in your wrongness and there in your wrongness and there in your wrongness and there in your wrongness and there in your wrongness and there in your wrongness and there in your wrongness and there in your wrongness and there in your wrongness and there in your wrongness and there in your wrongness and there in your wrongness and there in your wrongness and there in your wrongness and there in your wrongness and there in your wrongness and there in your wrongness and there in your wrongness and there in your wrongness and there in your wrongness and there in your wrongness and there in your wrongness and there in your wrongness and there in your wrongness and there in your wrongness and there in your wrongness and there in your wrongness and there in your wrongness and there in your wrongness and there in your wrongness and there in your wrongness and there in your wrongness and there in your wrongness and there in your wrongness and there in your wrongness and there in your wrongness and there in your wrongness and there in your wrongness and there in your wrongness and there in your wrongness and there in your wrongness and there in your wrongness and there in your wrongness and there in your wrongness and there in your wrongness and there in"
20,"Image describes The image shows a close-up of President Trump's face, with a serious expression as he addresses the nation. He is asking for $2.5 billion to fight the coronavirus, emphasizing the importance of the situation. The image captures the intensity of the moment and the determination of the President to tackle the pandemic."
21,"Image describes A statue of a hand holding a gavel stands in front of a building, possibly a government building. The statue is positioned in front of a clock, and there are two flags nearby. The scene suggests a sense of authority and power."
22,"Image describes A person in a blue glove is holding a red tube with the word ""coronavirus"" written on it. The tube is placed next to a row of vials, possibly containing different vaccines or treatments for the virus. The image suggests that the person is working in a lab or a medical facility, and is focused on finding a solution to the COVID-19 pandemic."
23,"Image describes A man and a child are sitting on a dock, enjoying a sunny day. The man is wearing a backpack and holding the child. This image illustrates the importance of creating cherished memories with loved ones during the summer season. Life insurance from AAA can help protect your family and ensure that these precious moments are not forgotten. and the video's audio describes you"
24,"Image describes A young woman is sitting on the floor in a hallway, surrounded by lockers. She has a laptop on her lap and is holding a remote control. The caption for this image could be ""A student working on her laptop in the hallway, ready to learn and adapt to new learning models."" and the video's audio describes rings. Please subscribe."
25,"Image describes A man with a beard and a blue jacket is smiling and posing for a picture in front of a crowd of people. He is wearing a tie and has a button on his jacket. The crowd is gathered in a large room, possibly for a political event or a gathering. The man's smile and the presence of the crowd suggest a positive and lively atmosphere."
26,"Image describes The image shows a map of Nigeria with the name ""Yobe"" in the top left corner. The Emir of Fika is celebrating the 11th anniversary of his coronation, which is a significant event for the community. The map provides context to the location of the celebration and highlights the importance of the event for the people in that region."
27,There is nothing here
28,There is nothing here
29,"Image describes A man with a blue tie and a blue shirt is standing in front of a microphone, giving a speech. He is wearing a suit and appears to be a politician. The man is looking at the camera and appears to be addressing an issue or making an announcement. The image is likely related to the tweet about a prominent donor backing a Democratic challenger against Sen. Lindsey Graham."
30,"Image describes A man in a red jacket stands in front of a white airplane. The man is smiling and appears to be a pilot. The airplane has the word ""Snowbirds"" on it."
31,"Image describes The image features a group of people playing badminton, with a total of 14 people visible in the scene. The players are spread out across the court, with some standing closer to the net and others further away. The image captures the excitement and energy of the game, making it a fitting representation of the upcoming PNB MetLife's JBC 4 match in Guwahati."
32,"Image describes The image shows a white and blue racing car with the number 2 on it, parked on a grassy area. The car is likely participating in a race or testing session. The tweet suggests that the driver, Robert, has completed 38 laps and is currently in second place. The tweet also contains a hashtag for Formula 1, indicating that the car is part of the F1 racing series."
33,"Image describes The image shows a large building with a statue on top, which is the Federal High Court Headquarters. The building is made of concrete and has a black fence in front of it. The tweet suggests that a court has disqualified a candidate for the APC Deputy Governorship position."
34,"Image describes Two men wearing white jackets and medals around their necks are standing next to each other, one of them pointing at the other. The man on the left has a medal around his neck, while the man on the right has a medal and a ribbon around his neck. They appear to be engaged in a conversation or celebrating an achievement."
35,"Image describes A race car is speeding down a track, with a large crowd of spectators watching the event. The weather is warm, with ambient temperatures at 27 degrees and track temperatures at 35 degrees. This is the hottest day of the Belgian Grand Prix, and the excitement is palpable as the race car makes its way around the track."
36,"Image describes A group of baseball players from the Boston Red Sox and New York Yankees pose for a photo with Prince Harry and Meghan, the Duke and Duchess of Sussex. The group is gathered together, with some players kneeling and others standing. The couple is holding a baby, possibly a gift, as they pose with the team members. The event takes place at the London Stadium, showcasing the connection between the royal family and the world of sports."
37,There is nothing here
38,"Image describes A man wearing a blue hat and blue shirt is smiling at the camera. He appears to be a Nigerian politician, as he is described as a ""Nigerian politician."" The image is likely related to the tweet about the Iseyin Indigenes and their support for the choice of caretaker chairmen."
39,"Image describes A sign in front of a building that says ""Enter Only""."
40,There is nothing here
41,There is nothing here
42,"Image describes A black and white photo of two women, one of whom is Melody Hobson, the other is Hamilton. They are both smiling and appear to be engaged in a conversation."
43,There is nothing here
44,There is nothing here
45,"Image describes The image accompanying the tweet is a graphic with a clock, a magnifying glass, and a person wearing a mask. The graphic is titled ""Prediction #6: The development of machine learning algorithms will lead to an arms race between defenders and attackers."" The image suggests that the tweet is about the advancements in machine learning and the potential consequences of such developments."
46,Image describes A large building with many windows serves as the backdrop for a tweet about easing and support measures for the economic sector in Cameroon. The tweet is from the Head of State and includes a hashtag for the country and the pandemic. The image captures the importance of the building and the message being conveyed.
47,There is nothing here
48,"Image describes A logo of a person running with the words ""Independent"" underneath it."
49,"Image describes The image features a beautiful beach scene with a palm tree in the foreground. The caption reads, ""ARM announces large-scale forcing data for the MJO Investigation Experiment on Gan Island in the Maldives."" The image and caption together create a visually appealing and informative tweet."
50,"Image describes A woman in a yellow sweater is holding a Starbucks cup and standing in a field of leaves. She is smiling and appears to be enjoying the fall season. The image captures the essence of the tweet, which is about loving fall and the Pumpkin Spice Latte."
51,There is nothing here
52,"Image describes A group of people at a baseball game are celebrating Mother's Day. They are holding up signs and cheering, with one woman in the crowd wearing a cap. The atmosphere is lively and festive, as everyone enjoys the game and the special occasion."
53,"Image describes A man in a suit, possibly a businessman, is giving a speech or making a statement. He is wearing a blue tie and appears to be addressing an audience. The man's hands are spread out, indicating a sense of authority or confidence in his message. The content of the tweet suggests that FIFA is proposing an indefinite suspension of the Premier League, which could have significant implications for the sport and its fans."
54,Image describes Two women posing for a picture together. One of them is wearing a leather jacket and glasses. They are standing in front of a blue background.
55,"Image describes A person is writing the letter ""V"" on their hand, possibly to show appreciation for a military veteran. The tweet encourages others to do the same and share their appreciation using the hashtag #HonorThroughAction."
56,"GIF describes A cartoon character, possibly a Pokemon, is shown with a sad expression and tears in its eyes. The character is wearing a white outfit and appears to be looking down. The image is likely meant to evoke emotions and create a sense of empathy for the character's situation."
57,"Image describes A man wearing a black sweater is smiling and looking at the camera. He is talking about a soccer team, specifically the Invincibles, and claims that another team would easily beat them. The man is likely a soccer fan or a player discussing the sport."
58,"Image describes The image is a graphic showing the key findings of the 2020 Trusted Access Report. The report explores how organizations are responding to the push toward remote work. The graphic is divided into sections, each with a title and a list of bullet points detailing the findings. The sections include Methodology, Key Findings, and Key Takeaways. The graphic is visually appealing and easy to read, providing a clear overview of the report's content."
59,"Image describes A man in a red suit stands next to a young boy in a similar suit, both with their arms outstretched. The man is smiling, while the boy is laughing. The image is a photoshopped picture of the man's son, and the man plans to take legal action against the person responsible."
60,"Image describes The image shows President Trump with a surprised look on his face, as if he has just heard some shocking news. The tweet he posted was labeled as misleading by Twitter, which is a first for the social media platform. The president's tweet was about mail-in voting, and Twitter's decision to label it as misleading sparked a debate about censorship and the role of social media in disseminating accurate information."
61,"Image describes Melinda Emerson, a business expert, is shown in a promotional image for her book ""Fix Your Business."" The book promises to help small business owners take control of their businesses and get their lives back in just 90 days. The book is available for purchase on Amazon."
62,"Image describes Atiku Abubakar and Bukola Saraki, two prominent Nigerian politicians, are seen discussing the All Progressives Congress (APC) in a meeting. They are addressing the issue of the party's alleged involvement with Ramon Olorunwa Abbas, also known as Hushpuppi, a notorious internet fraudster. The politicians are expressing their concerns and calling for an investigation into the matter. The image captures a moment of serious discussion between the two men, as they address the issue at hand."
63,There is nothing here
64,There is nothing here
65,"Image describes A person wearing gloves is holding a yellow vial of liquid in a lab setting. The vial is placed on a table with several other vials. The image suggests that the person is working with the vials in a scientific or medical context, possibly related to the COVID-19 pandemic and the CDC's recent revelation of additional symptoms for identifying positive cases."
66,"Image describes The image shows a group of five men wearing black shirts and black masks, kneeling on the grass. They are raising their fists in the air, making a powerful gesture of solidarity. The men appear to be soccer players, as they are wearing uniforms and are on a field. The scene conveys a sense of unity and strength among the group members."
67,"Image describes A large mammoth skeleton is displayed in a glass case, with a person standing behind it. The skeleton is described as a ""28,000-year-old baby woolly mammoth."" The image suggests that the mammoth was revived in a groundbreaking experiment by a 90-year-old Japanese scientist."
68,"Image describes A rugby player named Leone Nakarawa is having a successful season in the Champions Cup. He has scored four tries, carried the ball 111 times, beaten 22 defenders, offloaded the ball 20 times, and won 36 lineouts in eight matches."
69,"Image describes The image shows a laptop computer that has been folded in half, creating a compact and portable device. The laptop is open and ready for use, with a blue background. The tweet suggests that this is the world's first foldable PC, and it is likely meant to be a convenient and innovative product for users."
70,"Image describes A woman wearing a green hat and glasses is sitting with her hands clasped in front of her. She is smiling and appears to be engaged in a conversation or listening attentively. The image is likely related to the tweet about the Foundation's Empowerment Scheme in Abia, as it features a woman who may be a beneficiary or participant in the program. The tweet highlights the positive impact of the scheme on the community, showcasing the 600 benefits it has provided."
71,There is nothing here
72,"Image describes A woman wearing a scarf and a jacket is smiling and posing for the camera. She is standing in front of a wall with a picture of a man in uniform. The woman's outfit appears to be inspired by the military, as she is wearing a military-style jacket and scarf. The image captures a moment of confidence and style, showcasing the woman's unique fashion sense."
73,"Image describes A woman in a white shirt is standing in front of a wall. She is wearing a head wrap and looking at the camera. The image is a close-up of the woman, and she appears to be the main focus of the photo. The caption of the media is not provided, but it is likely related to the tweet about the female banker who was jailed for one year for fraud in Osogbo."
74,There is nothing here
75,"Image describes Kamala Harris, a Democratic senator from California, has announced her candidacy for the 2020 presidential election. Harris, who is of Indian and African-American descent, is the first woman and the first person of color to represent California in the U.S. Senate. She is known for her strong stance on issues such as healthcare, immigration, and criminal justice reform. Harris's announcement comes amidst a crowded field of Democratic candidates, including former Vice President Joe Biden and Senators Elizabeth Warren and Bernie Sanders."
